{
 "schema": "rtm-calllog-1.0",
 "tool_version": "0.3.0",
 "program": "L2MN-DEMO",
 "country": "MN",
 "round": 5,
 "enumerator_id": "E07",
 "assignment_fingerprint": "1497ccc06e215572e02bd87c55b94e656da6c9605c86b3a8bf082d08d67665b0",
 "chain_genesis": "1497ccc06e215572e02bd87c55b94e656da6c9605c86b3a8bf082d08d67665b0",
 "exported_at": "2026-10-30T18:00:00+08:00",
 "exported_by": "E07",
 "event_count": 49,
 "last_hash": "662be38da93e60252bb55c8bd93dbb26394b13152f73768e7121d5a3ce37fcff",
 "chain_verified": true,
 "contains_contact_information": false,
 "contacts_file": null,
 "events": [
  {
   "event_id": "fd69c89f-bc3f-44ca-bd95-b99a0210d69b",
   "type": "session",
   "program": "L2MN-DEMO",
   "round": 5,
   "what": "started",
   "fingerprint": "1497ccc06e215572e02bd87c55b94e656da6c9605c86b3a8bf082d08d67665b0",
   "fingerprint_ok": 1,
   "file": "E07_assignment_R05.json",
   "logged_by": "E07",
   "logged_at": "2026-10-26T08:58:00+08:00",
   "prev_hash": "1497ccc06e215572e02bd87c55b94e656da6c9605c86b3a8bf082d08d67665b0",
   "hash": "ad6c1d7a31871bd9f9c144a74fca83b1e7efa1342c8a9ce05e4890d137b85bd9"
  },
  {
   "event_id": "c2cf1619-6594-42f5-a9b5-87a5e99a9939",
   "type": "dial",
   "program": "L2MN-DEMO",
   "round": 5,
   "hhid": "0101-002",
   "phone_slot": 1,
   "ts": "2026-10-26T09:44:12+08:00",
   "end_ts": "2026-10-26T09:44:58+08:00",
   "status": "NO_ANSWER",
   "operator": "E07",
   "logged_by": "E07",
   "logged_at": "2026-10-26T09:45:21+08:00",
   "prev_hash": "ad6c1d7a31871bd9f9c144a74fca83b1e7efa1342c8a9ce05e4890d137b85bd9",
   "hash": "9e3da012b7c0a65a826f6ed272aef1a798e7c57aff2dcf14734716684ffc7707"
  },
  {
   "event_id": "fd3b5bed-573a-4299-9727-97cb5923880b",
   "type": "dial",
   "program": "L2MN-DEMO",
   "round": 5,
   "hhid": "0101-004",
   "phone_slot": 1,
   "ts": "2026-10-26T10:27:36+08:00",
   "end_ts": "2026-10-26T10:28:04+08:00",
   "status": "NO_ANSWER",
   "operator": "E07",
   "logged_by": "E07",
   "logged_at": "2026-10-26T10:28:12+08:00",
   "prev_hash": "9e3da012b7c0a65a826f6ed272aef1a798e7c57aff2dcf14734716684ffc7707",
   "hash": "89c930a1e77ac7a9497e0903b32cc737b296ba3de18cd34e874126a4f6f4fd3d"
  },
  {
   "event_id": "66dc6ff6-cd0a-4c70-9d6f-1b79449960b8",
   "type": "dial",
   "program": "L2MN-DEMO",
   "round": 5,
   "hhid": "0113-004",
   "phone_slot": 1,
   "ts": "2026-10-26T11:00:04+08:00",
   "end_ts": "2026-10-26T11:00:47+08:00",
   "status": "DEAD_NUMBER",
   "operator": "E07",
   "logged_by": "E07",
   "logged_at": "2026-10-26T11:01:24+08:00",
   "prev_hash": "89c930a1e77ac7a9497e0903b32cc737b296ba3de18cd34e874126a4f6f4fd3d",
   "hash": "666a0c9156d444d01e63aafdeed4fadb76c63b0583e89e775c7414af806afe97"
  },
  {
   "event_id": "26a93771-9d3d-4117-b12c-a8337a80a299",
   "type": "action",
   "program": "L2MN-DEMO",
   "round": 5,
   "hhid": "0113-004",
   "action": "REMOVE_REQUEST",
   "reason": "no number works",
   "logged_by": "E07",
   "logged_at": "2026-10-26T11:02:24+08:00",
   "prev_hash": "666a0c9156d444d01e63aafdeed4fadb76c63b0583e89e775c7414af806afe97",
   "hash": "7ab02edb6c1595b1aee9bd8898da8176060973c695b5d4b0620de3a3ddb779d5"
  },
  {
   "event_id": "1b7fed8b-205e-4de1-b77b-871ddac6fbbb",
   "type": "dial",
   "program": "L2MN-DEMO",
   "round": 5,
   "hhid": "0104-001",
   "phone_slot": 1,
   "ts": "2026-10-26T11:40:53+08:00",
   "end_ts": "2026-10-26T11:41:32+08:00",
   "status": "NO_ANSWER",
   "operator": "E07",
   "logged_by": "E07",
   "logged_at": "2026-10-26T11:41:51+08:00",
   "prev_hash": "7ab02edb6c1595b1aee9bd8898da8176060973c695b5d4b0620de3a3ddb779d5",
   "hash": "2753aa5d79b991be7cc0b12105533512f3233ccd70cdb180a2d38bd93eef5682"
  },
  {
   "event_id": "129ea1f4-8fd4-4758-8eb3-b7a51e087f71",
   "type": "dial",
   "program": "L2MN-DEMO",
   "round": 5,
   "hhid": "0101-002",
   "phone_slot": 1,
   "ts": "2026-10-26T12:27:21+08:00",
   "end_ts": "2026-10-26T12:28:02+08:00",
   "status": "NO_ANSWER",
   "operator": "E07",
   "logged_by": "E07",
   "logged_at": "2026-10-26T12:28:10+08:00",
   "prev_hash": "2753aa5d79b991be7cc0b12105533512f3233ccd70cdb180a2d38bd93eef5682",
   "hash": "f1f2b4b034a8f1f16b783c4dea33fd5dfed06d8e2eb025f6522baaf903399d23"
  },
  {
   "event_id": "a9b303e3-eda0-4421-9b44-dbae4cb50415",
   "type": "dial",
   "program": "L2MN-DEMO",
   "round": 5,
   "hhid": "0113-006",
   "phone_slot": 1,
   "ts": "2026-10-26T12:42:38+08:00",
   "end_ts": "2026-10-26T12:42:50+08:00",
   "status": "BUSY",
   "operator": "E07",
   "logged_by": "E07",
   "logged_at": "2026-10-26T12:43:14+08:00",
   "prev_hash": "f1f2b4b034a8f1f16b783c4dea33fd5dfed06d8e2eb025f6522baaf903399d23",
   "hash": "b22e096462e2cac09e64044e40bf25e4bb0a8bd0e269dd1ba1f7e637c9e0a52e"
  },
  {
   "event_id": "9b7e806b-18c2-4494-b1af-e870ba6ae611",
   "type": "dial",
   "program": "L2MN-DEMO",
   "round": 5,
   "hhid": "0104-001",
   "phone_slot": 1,
   "ts": "2026-10-26T13:36:16+08:00",
   "end_ts": "2026-10-26T13:36:52+08:00",
   "status": "SWITCHED_OFF",
   "operator": "E07",
   "logged_by": "E07",
   "logged_at": "2026-10-26T13:37:07+08:00",
   "prev_hash": "b22e096462e2cac09e64044e40bf25e4bb0a8bd0e269dd1ba1f7e637c9e0a52e",
   "hash": "a6572ff68ec757fe11ae7fec22bb5abc6910d9960e41a942cf7b106591581c33"
  },
  {
   "event_id": "c6efed99-0817-458d-84a1-38ef3640a913",
   "type": "dial",
   "program": "L2MN-DEMO",
   "round": 5,
   "hhid": "0101-004",
   "phone_slot": 1,
   "ts": "2026-10-26T13:44:58+08:00",
   "end_ts": "2026-10-26T13:45:28+08:00",
   "status": "NO_ANSWER",
   "operator": "E07",
   "logged_by": "E07",
   "logged_at": "2026-10-26T13:45:36+08:00",
   "prev_hash": "a6572ff68ec757fe11ae7fec22bb5abc6910d9960e41a942cf7b106591581c33",
   "hash": "92bdcbdc8b1501e0839d2b7b114862246ea4cd5426fbc4dc23d1b91a108ee041"
  },
  {
   "event_id": "724a9da3-fd88-44d9-aff3-583fad710dbb",
   "type": "dial",
   "program": "L2MN-DEMO",
   "round": 5,
   "hhid": "0101-002",
   "phone_slot": 1,
   "ts": "2026-10-26T14:14:04+08:00",
   "end_ts": "2026-10-26T14:14:29+08:00",
   "status": "NO_ANSWER",
   "operator": "E07",
   "logged_by": "E07",
   "logged_at": "2026-10-26T14:14:35+08:00",
   "prev_hash": "92bdcbdc8b1501e0839d2b7b114862246ea4cd5426fbc4dc23d1b91a108ee041",
   "hash": "510c3c3e0f715cbe87284bdbff1e8b7f22a69825fa6c96c1edaf456fa0ef79a8"
  },
  {
   "event_id": "2709aba3-c021-47b2-8a0d-701d2512e30d",
   "type": "dial",
   "program": "L2MN-DEMO",
   "round": 5,
   "hhid": "0101-002",
   "phone_slot": 1,
   "ts": "2026-10-26T16:21:28+08:00",
   "end_ts": "2026-10-26T16:22:08+08:00",
   "status": "NO_ANSWER",
   "operator": "E07",
   "logged_by": "E07",
   "logged_at": "2026-10-26T16:22:28+08:00",
   "prev_hash": "510c3c3e0f715cbe87284bdbff1e8b7f22a69825fa6c96c1edaf456fa0ef79a8",
   "hash": "f0225e74c4ca1efbcc027779cba24201cb9e7bb985209c36ae9c395ba49bf138"
  },
  {
   "event_id": "924abeaa-754f-4ca2-ae70-817e5a647eee",
   "type": "dial",
   "program": "L2MN-DEMO",
   "round": 5,
   "hhid": "0101-002",
   "phone_slot": 1,
   "ts": "2026-10-27T10:00:13+08:00",
   "end_ts": "2026-10-27T10:01:00+08:00",
   "status": "NO_ANSWER",
   "operator": "E07",
   "logged_by": "E07",
   "logged_at": "2026-10-27T10:01:25+08:00",
   "prev_hash": "f0225e74c4ca1efbcc027779cba24201cb9e7bb985209c36ae9c395ba49bf138",
   "hash": "d44ab540540ff8b654a62e9c2e12d515f67e52151a0d297bc69879c9330dff37"
  },
  {
   "event_id": "952e2c2c-898e-427e-8c13-29919375eccf",
   "type": "dial",
   "program": "L2MN-DEMO",
   "round": 5,
   "hhid": "0101-004",
   "phone_slot": 1,
   "ts": "2026-10-27T10:10:40+08:00",
   "end_ts": "2026-10-27T10:11:20+08:00",
   "status": "SWITCHED_OFF",
   "operator": "E07",
   "logged_by": "E07",
   "logged_at": "2026-10-27T10:11:55+08:00",
   "prev_hash": "d44ab540540ff8b654a62e9c2e12d515f67e52151a0d297bc69879c9330dff37",
   "hash": "031b14f6bde2528f160f040c7423da5bd21086d871453ae7acf0683d9c06883a"
  },
  {
   "event_id": "f2b33aa7-d3e7-48c2-b886-f840fb8e0f73",
   "type": "dial",
   "program": "L2MN-DEMO",
   "round": 5,
   "hhid": "0105-003",
   "phone_slot": 1,
   "ts": "2026-10-27T12:09:58+08:00",
   "end_ts": "2026-10-27T12:10:34+08:00",
   "status": "APPOINTMENT",
   "operator": "E07",
   "appointment_ts": "2026-10-27T18:00:00+08:00",
   "logged_by": "E07",
   "logged_at": "2026-10-27T12:11:04+08:00",
   "prev_hash": "031b14f6bde2528f160f040c7423da5bd21086d871453ae7acf0683d9c06883a",
   "hash": "0375f16663ce9007e8ddb65f8484eb1068de99ca0729ce4d59c2adc11e552874"
  },
  {
   "event_id": "8a7ebc40-0a70-47a5-8998-5eca972a061c",
   "type": "dial",
   "program": "L2MN-DEMO",
   "round": 5,
   "hhid": "0101-004",
   "phone_slot": 1,
   "ts": "2026-10-27T12:12:32+08:00",
   "end_ts": "2026-10-27T12:12:49+08:00",
   "status": "SWITCHED_OFF",
   "operator": "E07",
   "action": "RELEASE",
   "logged_by": "E07",
   "logged_at": "2026-10-27T12:13:08+08:00",
   "prev_hash": "0375f16663ce9007e8ddb65f8484eb1068de99ca0729ce4d59c2adc11e552874",
   "hash": "4695d009752506e0df9dff98713503f5051955e250e63665626b6e75e678ba0a"
  },
  {
   "event_id": "b89ce70f-b7bb-4980-ad13-d34e5f908c9a",
   "type": "dial",
   "program": "L2MN-DEMO",
   "round": 5,
   "hhid": "0101-002",
   "phone_slot": 1,
   "ts": "2026-10-27T13:22:01+08:00",
   "end_ts": "2026-10-27T13:22:13+08:00",
   "status": "SWITCHED_OFF",
   "operator": "E07",
   "logged_by": "E07",
   "logged_at": "2026-10-27T13:22:51+08:00",
   "prev_hash": "4695d009752506e0df9dff98713503f5051955e250e63665626b6e75e678ba0a",
   "hash": "fbf88e236b05056eaa9627fab3c6f2b5e01d775067a617cda11b7fa38f385cf6"
  },
  {
   "event_id": "5549c675-bad8-45de-ab46-6a043f905b59",
   "type": "dial",
   "program": "L2MN-DEMO",
   "round": 5,
   "hhid": "0101-002",
   "phone_slot": 1,
   "ts": "2026-10-27T16:05:50+08:00",
   "end_ts": "2026-10-27T16:06:17+08:00",
   "status": "NO_ANSWER",
   "operator": "E07",
   "logged_by": "E07",
   "logged_at": "2026-10-27T16:06:57+08:00",
   "prev_hash": "fbf88e236b05056eaa9627fab3c6f2b5e01d775067a617cda11b7fa38f385cf6",